Q#,DePuy,Stryker,Zimmer Biomet
1,60mm,65mm,70mm long
2,"Yes, there is a cementless option mentioned in the DePuy Orthogenesis Limb Preservation System Surgical Techniques reference document.",Yes,Yes
3,"To check rotation in the DePuy Orthogenesis Limb Preservation System Surgical Techniques, you can use the following method:

1. **Visual Inspection**: Observe the alignment of the limb in relation to the pelvis and the foot.
2. **Clinical Examination**: Assess the position of the patella and the foot to ensure they are aligned correctly.
3. **Radiographic Evaluation**: Use imaging techniques to confirm the rotational alignment of the components.

These steps help ensure that the rotation is within the desired parameters for optimal function.",Should be aligned with linea aspera.,"To check rotation in the Zimmer Biomet Segmental Distal Femoral Replacement Surgical Technique, you can follow these steps:

1. **Visual Inspection**: Observe the alignment of the limb in relation to the pelvis and the foot to ensure proper rotational alignment.

2. **Patellar Positioning**: Assess the position of the patella. It should be facing forward and aligned with the midline of the tibia.

3. **Clinical Examination**: Evaluate the range of motion and feel for any resistance or abnormal movement that may indicate improper rotation.

4. **Radiographic Evaluation**: Use imaging techniques, such as X-rays, to confirm the rotational alignment of the components.

These steps help ensure that the rotation is within the desired parameters for optimal function of the knee joint."
4,The shortest construct that can be used in the DePuy Orthogenesis Limb Preservation System is 70 mm. ,76mm without body and 105mm with body,60mm
5,0 degrees,Zero degrees,0 degrees
6,"12, 14, 16, 18, 20, 22, 24, 26, 28mm","11, 13, 16, 19, 22 mm",Nowhere to be found (9mm to 24mm per rep)
7,"The minimum stem diameter in the DePuy Orthogenesis Limb Preservation System is 10 mm for cemented straight stems, 11.5mm for porous straight stems, and 11mm for cemented bowed stems.",8mm,11mm
8,The smallest body segment is 25mm and is available in 5mm increments alone or in combination with other segmental components to adjust length.,"There is only one body segment length of 40mm that is extra-cortical. However, there are multiple extension pieces lengths in 10mm increments to achieve a construct as long as 325mm. This is all found in page 49.","3, 4, 5, 7, 9, 11, 13, 15, 17, 19, 21, 23cm "
9,The maximum stem diameter in the DePuy Orthogenesis Limb Preservation System is 18.5 mm porous straight.,17mm is the largest stem diameter for either curved or straight.,19mm.
10,The tibial cone sizes available in the DePuy Orthogenesis Limb Preservation System are 21mm proximal and 14mm distal on the tibia. Small accommodates up to 14 mm stem. Medium accommodate up to 16 mm stem. Large accommodates up to 20 mm stem. X-Large accommodate up to 22 mm stem.,"Symmetric and asymmetric. Each come in sizes A, B, C, D, and E. ","Extra-small, small, medium, and large. Large cones should be used if the defect is greater than 46mm. Extra-small or small should generally be used."
11,"The augment sizes available on the tibia in the DePuy Orthogenesis Limb Preservation System are 5 mm, 10 mm, and 15 mm.",Augments come in 5mm and 10mm increments for each tibial size.,"The augment sizes available on the tibia in the Zimmer Biomet Segmental Distal Femoral Replacement Surgical Technique are 5 mm, 10 mm, and 15 mm."
12,The minimum total distal femur resection in the DePuy Orthogenesis Limb Preservation System is 70 mm.,The minimum resection length is 76mm,70mm
13,No.,There is not.,No
14,Attune Revision RP tibia is 61mm long and 14mm wide.,56mm long and 15mm wide,It ranges from 23mm to 40mm depending on the tibial size. The diameter is 14mm. 
15,"The minimum reamer that must be used on the femur is 10 mm, and for the tibia, it is also 10 mm in the DePuy Orthogenesis Limb Preservation System.",The minimum reamer is 10mm.,11mm. 
16,"Yes, there is a distal femur resection guide available for measurement in the DePuy Orthogenesis Limb Preservation System.","Yes, there is a distal femur resection guide available for measurement in the Stryker Triathlon TS Femur and Revision Baseplate.",Yes
17,The valgus angle of the distal femoral cut in the DePuy Orthogenesis Limb Preservation System is 5 degrees.,The valgus angle of the distal femoral cut in the Stryker Triathlon TS Femur and Revision Baseplate is 6 degrees.,5 degrees
18,"To evaluate and change the construct if the knee does not fully extend in the DePuy Orthogenesis Limb Preservation System, the following steps should be taken:

1. **Assess the Alignment**: Check the alignment of the femoral and tibial components to ensure they are properly positioned.
2. **Evaluate Soft Tissue Tension**: Examine the soft tissue around the knee, including ligaments and tendons, to determine if there is excessive tension preventing full extension.
3. **Check for Bony Impingement**: Look for any bony impingement that may be limiting the range of motion.
4. **Adjust the Construct**: Based on the findings, consider adjusting the length of the components or the positioning of the resection to facilitate better extension.
5. **Reassess Range of Motion**: After making adjustments, reassess the knee's range of motion to ensure that full extension is achievable.

These steps help in identifying the cause of limited extension and guide the necessary modifications to the construct.",Cut more distal femur or shorten the construct.,"If the knee does not fully extend in the Zimmer Biomet Segmental Distal Femoral Replacement Surgical Technique, the following steps should be evaluated to change the construct:

1. **Assess Component Alignment**: Check the alignment of the femoral and tibial components to ensure they are properly positioned and not contributing to the limitation in extension.

2. **Evaluate Soft Tissue Tension**: Examine the surrounding soft tissues, including ligaments and tendons, to determine if there is excessive tension that may be preventing full extension.

3. **Check for Bony Impingement**: Look for any bony impingement that may be limiting the range of motion and address it accordingly.

4. **Adjust the Construct**: Based on the findings, consider adjusting the length of the components or the positioning of the resection to facilitate better extension.

5. **Reassess Range of Motion**: After making adjustments, reassess the knee's range of motion to ensure that full extension is achievable.

6. **Consider Additional Procedures**: If necessary, consider additional surgical procedures, such as a release of tight structures, to improve extension.

These steps help identify the cause of limited extension and guide the necessary modifications to the construct for optimal function."
19,"If the knee is too recurvatum in flexion and extension in the DePuy Orthogenesis Limb Preservation System, the following steps should be evaluated to change the construct:

1. **Assess Component Positioning**: Check the positioning of the femoral and tibial components to ensure they are correctly aligned and not contributing to the recurvatum deformity.

2. **Evaluate Soft Tissue Balance**: Examine the soft tissue around the knee, including ligaments and tendons, to determine if there is an imbalance that may be causing the recurvatum.

3. **Check for Bony Impingement**: Look for any bony impingement that may be affecting the knee's range of motion and contributing to the recurvatum.

4. **Adjust the Construct**: Based on the assessment, consider adjusting the length or positioning of the components to correct the recurvatum. This may involve changing the angle of the cuts or the alignment of the components.

5. **Reassess Range of Motion**: After making adjustments, reassess the knee's range of motion to ensure that the recurvatum has been addressed.

Regarding the bumper in this scenario, the bumper can be adjusted or replaced to provide better support and stability to the knee joint. It can help in managing the soft tissue tension and improving the overall alignment of the knee, thereby aiding in the correction of the recurvatum deformity.",Lengthen the construct.,"If the knee is too recurvatum in flexion and extension in the Zimmer Biomet Segmental Distal Femoral Replacement Surgical Technique, the following steps should be evaluated to change the construct:

1. **Assess Component Positioning**: Check the positioning of the femoral and tibial components to ensure they are correctly aligned and not contributing to the recurvatum deformity.

2. **Evaluate Soft Tissue Balance**: Examine the soft tissue around the knee, including ligaments and tendons, to determine if there is an imbalance that may be causing the recurvatum.

3. **Check for Bony Impingement**: Look for any bony impingement that may be affecting the knee's range of motion and contributing to the recurvatum.

4. **Adjust the Construct**: Based on the assessment, consider adjusting the length or positioning of the components to correct the recurvatum. This may involve changing the angle of the cuts or the alignment of the components.

5. **Reassess Range of Motion**: After making adjustments, reassess the knee's range of motion to ensure that the recurvatum has been addressed.

Regarding the bumper in this scenario, the bumper can be adjusted or replaced to provide better support and stability to the knee joint. It can help in managing the soft tissue tension and improving the overall alignment of the knee, thereby aiding in the correction of the recurvatum deformity. Adjusting the bumper may also help in redistributing forces across the knee joint, which can further assist in achieving a more neutral alignment."
20,"If the patella is laterally dislocating in the DePuy Orthogenesis Limb Preservation System, the following modifications can be made to the tibia:

1. **Tibial Tuberosity Transfer**: Consider transferring the tibial tuberosity medially to realign the patellar tracking and reduce lateral dislocation.

2. **Adjusting the Tibial Cut**: Modify the angle of the tibial cut to improve the alignment of the patellar tracking. This may involve changing the orientation to create a more favorable angle for the patella.

3. **Using a Lateral Release**: If necessary, perform a lateral release of the retinaculum to relieve tension on the lateral structures that may be contributing to the dislocation.

4. **Evaluate Soft Tissue Balance**: Assess the soft tissue around the knee, including the iliotibial band and lateral retinaculum, and make adjustments as needed to improve the balance and support for the patella.

5. **Reassess Patellar Tracking**: After making these modifications, reassess the patellar tracking to ensure that the changes have effectively addressed the lateral dislocation.

These steps aim to improve the alignment and stability of the patella, reducing the risk of dislocation.",Externally rotate the tibia or consider externally rotating the femoral component.,"If the patella is laterally dislocating in the Zimmer Biomet Segmental Distal Femoral Replacement Surgical Technique, the following modifications can be made to the tibia:

1. **Tibial Tuberosity Transfer**: Consider transferring the tibial tuberosity medially to realign the patellar tracking and reduce lateral dislocation.

2. **Adjusting the Tibial Cut**: Modify the angle of the tibial cut to improve the alignment of the patellar tracking. This may involve changing the orientation to create a more favorable angle for the patella.

3. **Using a Lateral Release**: If necessary, perform a lateral release of the retinaculum to relieve tension on the lateral structures that may be contributing to the dislocation.

4. **Evaluate Soft Tissue Balance**: Assess the soft tissue around the knee, including the iliotibial band and lateral retinaculum, and make adjustments as needed to improve the balance and support for the patella.

5. **Reassess Patellar Tracking**: After making these modifications, reassess the patellar tracking to ensure that the changes have effectively addressed the lateral dislocation.

These steps aim to improve the alignment and stability of the patella, reducing the risk of dislocation and enhancing overall knee function.
"
21,"In the setting of a distal femur fracture, the choices for the tibial component in the DePuy Orthogenesis Limb Preservation System include:

1. **Standard Tibial Component**: This is typically used for most cases and provides a stable foundation for the limb.

2. **Augmented Tibial Component**: This option is used when there is significant bone loss or deformity that requires additional support.

3. **Cemented Tibial Component**: This may be chosen for patients with poor bone quality or when additional fixation is needed.

To decide which is the best option, consider the following factors:

- **Bone Quality**: Assess the quality and quantity of the bone in the tibia. Poor bone quality may necessitate a cemented option or an augmented component.

- **Extent of the Fracture**: Evaluate the severity and location of the distal femur fracture. If there is significant displacement or instability, an augmented component may provide better support.

- **Patient Factors**: Consider the patient's age, activity level, and overall health. Younger, more active patients may benefit from a standard component, while older patients with lower activity levels may require a more stable option.

- **Surgeon's Preference and Experience**: The surgeon's familiarity with the components and their outcomes can also influence the choice.

By evaluating these factors, the most appropriate tibial component can be selected to optimize the surgical outcome.
",The revision baseplate or MRH baseplate.,"In the setting of a distal femur fracture, the choices for the tibial component in the Zimmer Biomet Segmental Distal Femoral Replacement Surgical Technique include:

1. **Standard Tibial Component**: This is typically used for most cases and provides a stable foundation for the limb.

2. **Augmented Tibial Component**: This option is used when there is significant bone loss or deformity that requires additional support.

3. **Cemented Tibial Component**: This may be chosen for patients with poor bone quality or when additional fixation is needed.

To decide which is the best option, consider the following factors:

- **Bone Quality**: Assess the quality and quantity of the bone in the tibia. Poor bone quality may necessitate a cemented option or an augmented component.

- **Extent of the Fracture**: Evaluate the severity and location of the distal femur fracture. If there is significant displacement or instability, an augmented component may provide better support.

- **Patient Factors**: Consider the patient's age, activity level, and overall health. Younger, more active patients may benefit from a standard component, while older patients with lower activity levels may require a more stable option.

- **Surgeon's Preference and Experience**: The surgeon's familiarity with the components and their outcomes can also influence the choice.

By evaluating these factors, the most appropriate tibial component can be selected to optimize the surgical outcome."
22,Cement the implant.,Cement the femoral component.,"If diaphyseal fixation in the femur cannot be achieved in the Zimmer Biomet Segmental Distal Femoral Replacement Surgical Technique, the following options can be considered:

1. **Use of a Longer Stem**: Opt for a longer stem that can provide better engagement in the proximal femur or other areas where bone quality is better.

2. **Cemented Fixation**: Consider using a cemented fixation method to enhance stability, especially in cases of poor bone quality.

3. **Augmented Components**: Utilize augmented components that can provide additional support and stability in the absence of adequate diaphyseal fixation.

4. **Alternative Fixation Techniques**: Explore alternative fixation techniques, such as using plates or external fixators, to stabilize the femur while allowing for healing.

5. **Reassess Surgical Approach**: Evaluate the surgical approach to ensure optimal access and alignment, which may facilitate better fixation options.

6. **Consultation with a Specialist**: If necessary, consult with a specialist in orthopedic surgery to explore advanced techniques or alternative solutions for achieving stability.

These options aim to provide adequate fixation and stability in the absence of diaphyseal fixation, ensuring a successful surgical outcome."
23,"A distal femoral replacement should be used or considered in the following situations:

1. **Severe Bone Loss**: When there is significant bone loss in the distal femur due to trauma, tumor resection, or infection that cannot be adequately addressed with other fixation methods.

2. **Non-Union or Malunion**: In cases where there is a non-union or malunion of the distal femur that cannot be corrected with traditional fixation techniques.

3. **Complex Fractures**: For complex fractures of the distal femur that involve significant comminution or instability, where standard fixation methods may not provide sufficient stability.

4. **Revision Surgery**: In revision surgeries where previous implants have failed, and there is a need for a more stable and robust solution.

5. **Tumor Resection**: Following the resection of tumors in the distal femur, where reconstruction is necessary to restore limb function and stability.

6. **Infection**: In cases of chronic infection that have led to bone loss or instability, a distal femoral replacement may be necessary to manage the condition effectively.

In these scenarios, a distal femoral replacement can provide a stable and functional solution, allowing for improved mobility and quality of life for the patient.","A distal femoral replacement should be used or considered in the following situations:

1. **Severe Bone Loss**: When there is significant bone loss in the distal femur due to trauma, tumor resection, or infection that cannot be adequately addressed with other fixation methods.

2. **Non-Union or Malunion**: In cases where there is a non-union or malunion of the distal femur that cannot be corrected with traditional fixation techniques.

3. **Complex Fractures**: For complex fractures of the distal femur that involve significant comminution or instability, where standard fixation methods may not provide sufficient stability.

4. **Revision Surgery**: In revision surgeries where previous implants have failed, and there is a need for a more stable and robust solution.

5. **Tumor Resection**: Following the resection of tumors in the distal femur, where reconstruction is necessary to restore limb function and stability.

6. **Infection**: In cases of chronic infection that have led to bone loss or instability, a distal femoral replacement may be necessary to manage the condition effectively.

In these scenarios, a distal femoral replacement can provide a stable and functional solution, allowing for improved mobility and quality of life for the patient.","A distal femoral replacement should be used or considered in the following situations:

1. **Severe Bone Loss**: When there is significant bone loss in the distal femur due to trauma, tumor resection, or infection that cannot be adequately addressed with other fixation methods.

2. **Non-Union or Malunion**: In cases where there is a non-union or malunion of the distal femur that cannot be corrected with traditional fixation techniques.

3. **Complex Fractures**: For complex fractures of the distal femur that involve significant comminution or instability, where standard fixation methods may not provide sufficient stability.

4. **Revision Surgery**: In revision surgeries where previous implants have failed, and there is a need for a more stable and robust solution.

5. **Tumor Resection**: Following the resection of tumors in the distal femur, where reconstruction is necessary to restore limb function and stability.

6. **Infection**: In cases of chronic infection that have led to bone loss or instability, a distal femoral replacement may be necessary to manage the condition effectively.

In these scenarios, a distal femoral replacement can provide a stable and functional solution, allowing for improved mobility and quality of life for the patient."
24,Change your implant or shorten the construct.,"Shorten the construct, rotate the component, or remove the patella.",Shorten construct 
25,"If there is patellar impingement on the mechanism in the DePuy Orthogenesis Limb Preservation System, the following choices can be considered to modify the construct:

1. **Adjust the Position of the Patellar Component**: Reassess and potentially reposition the patellar component to ensure it is aligned properly and not causing impingement.

2. **Modify the Femoral Component**: If the femoral component is contributing to the impingement, consider adjusting its position or orientation to alleviate the pressure on the patella.

3. **Increase the Patellar Thickness**: If feasible, using a thicker patellar component may help in reducing the impingement by providing better clearance.

4. **Perform a Lateral Release**: If the lateral structures are tight, a lateral release may help reduce tension and allow for better patellar tracking, thereby alleviating impingement.

5. **Evaluate Soft Tissue Tension**: Assess the surrounding soft tissues for any excessive tension that may be contributing to the impingement and make necessary adjustments.

6. **Consider a Different Patellar Design**: If the current design is not suitable, consider using a different patellar design that may provide better clearance and reduce the risk of impingement.

7. **Reassess the Overall Alignment**: Ensure that the overall alignment of the limb is correct, as malalignment can contribute to patellar impingement.

These modifications aim to alleviate the impingement and improve the function of the knee joint while maintaining the stability of the construct.","Shorten the construct, rotate the component, or remove the patella.",Shorten or rotate
26,"No bumper. Poly sizes are 12, 14, 16, 18, 20, 22, 24, 26, 28mm","Neutral or 3 degree bumper. 11, 13, 16, 19, 22 mm poly.",9mm to 24mm per rep. NO bumper.
27,Posterior condylar hinge. The central femoral hinge has better quad efficiency and lower dislocation rate.,"The Stryker Triathlon TS Femur and Revision Baseplate utilizes a **central femoral hinge** design. This design is known to provide better quadriceps efficiency and a lower dislocation rate compared to a posterior condylar hinge. The central femoral hinge allows for more natural knee mechanics, contributing to improved function and stability.",It uses a posterior condylar hinge. Central is better.
28,No.,"Yes, there is an all-poly tibial baseplate option available in the Stryker Triathlon TS Femur and Revision Baseplate that can be used as a spacer. This option is designed to provide stability and support while allowing for flexibility in surgical planning.",No.